id,view1,view2,view3,view1_txt,view2_txt,view3_txt
2,11,17,1,"A person in a white hoodie, black patterned trousers, light gray sneakers, holding a pink bottle.","A person in a white hoodie, black trousers, white sneakers, holding a water bottle.","A person with a black beanie, in a white hoodie, black trousers, white sneakers, holding a pink-capped bottle."
4,5,1,3,"A person with a dark beanie, in a black coat, gray trousers, dark shoes, holding a pink phone.","A person in a black coat, dark gray trousers, black shoes, holding a red bottle.",A person in a black jacket and gray trousers.
14,14,13,13,"A person in an orange top, light gray trousers, white sneakers, holding a light object.","A person in an orange top, light gray trousers, white sneakers, holding a phone.",A person in a peach top and light gray trousers.
15,7,15,4,"A person with a black beanie, in a black coat, black trousers, white sneakers, carrying a lavender bag.","A person in a black coat, black trousers, white sneakers.","A person with a dark cap, in a black coat with gray graphic, black trousers, white sneakers, holding a light garment."
16,4,3,11,"A person in a dark coat, dark trousers, dark shoes, holding white shopping bags.","A person in a black coat, dark trousers, brown shoes, holding a shopping bag.","A person with a light beanie, in a black coat, dark trousers, holding a white bag with blue accents."
17,10,11,6,"A person in a light gray top, black trousers, black boots, holding a white bag.","A person in a striped top, black trousers, black boots, carrying a white bag.",A person in a light gray coat and black trousers.
